{"items":[{"asset_id":"char-hero","asset_type":"character","is_placeholder":true,"license":{"attribution_required":false,"spdx_id":"LicenseRef-proprietary"},"metadata":{"license_type":"proprietary_cleared","retrieval_date":"1970-01-01T00:00:00Z"},"producer":"media/resolvers/local","schema_id":"urn:media:resolved-asset","schema_version":"1.0.0","source":{"type":"generated_placeholder"},"uri":"placeholder://character/char-hero"}],"manifest_id":"manifest-minimal","producer":"media/generate_media.py","schema_id":"AssetManifest.media","schema_version":"1.0.0"}
